{
  "command_id": "cmd-wp000-007",
  "user_id": "user-207",
  "timestamp": "2026-02-01T10:06:00+00:00",
  "text": "Сделай что-нибудь полезное",
  "capabilities": ["start_job", "propose_create_task", "propose_add_shopping_item", "clarify"],
  "context": {
    "household": {
      "members": [{"user_id": "user-207"}]
    }
  }
}
