{
  "command_id": "cmd-wp000-011",
  "user_id": "user-211",
  "timestamp": "2026-02-01T10:10:00+00:00",
  "text": "Купи молоко и убери кухню",
  "capabilities": ["start_job", "propose_create_task", "propose_add_shopping_item", "clarify"],
  "context": {
    "household": {
      "household_id": "house-211",
      "members": [{"user_id": "user-211", "display_name": "Катя"}],
      "zones": [{"zone_id": "zone-kitchen", "name": "Кухня"}],
      "shopping_lists": [{"list_id": "list-3", "name": "Продукты"}]
    },
    "defaults": {"default_list_id": "list-3", "default_assignee_id": "user-211"}
  }
}
