{
  "command_id": "cmd-100",
  "user_id": "user-77",
  "timestamp": "2024-05-12T15:30:00Z",
  "text": "Сделай задачу: убрать в гостиной",
  "capabilities": [
    "start_job",
    "propose_create_task",
    "propose_add_shopping_item",
    "clarify"
  ],
  "context": {
    "household": {
      "household_id": "house-77",
      "members": [
        {"user_id": "user-77", "display_name": "Ирина"}
      ],
      "zones": [
        {"zone_id": "zone-living", "name": "Гостиная"}
      ]
    },
    "defaults": {
      "default_assignee_id": "user-77"
    }
  }
}
