{
  "command_id": "cmd-wp000-004",
  "user_id": "user-204",
  "timestamp": "2026-02-01T10:03:00+00:00",
  "text": "Починить кран на кухне",
  "capabilities": ["start_job", "propose_create_task", "propose_add_shopping_item", "clarify"],
  "context": {
    "household": {
      "household_id": "house-204",
      "members": [{"user_id": "user-204", "display_name": "Макс"}],
      "zones": [{"zone_id": "zone-kitchen", "name": "Кухня"}]
    },
    "defaults": {"default_assignee_id": "user-204"}
  }
}
