{
  "command_id": "cmd-wp000-009",
  "user_id": "user-209",
  "timestamp": "2026-02-01T10:08:00+00:00",
  "text": "Нужно помыть окна",
  "capabilities": ["start_job", "propose_create_task", "propose_add_shopping_item", "clarify"],
  "context": {
    "household": {
      "household_id": "house-209",
      "members": [{"user_id": "user-209", "display_name": "Петя"}]
    }
  }
}
