{
  "command_id": "cmd-wp000-008",
  "user_id": "user-208",
  "timestamp": "2026-02-01T10:07:00+00:00",
  "text": "Купи бананы",
  "capabilities": ["start_job", "propose_create_task", "propose_add_shopping_item", "clarify"],
  "context": {
    "household": {
      "household_id": "house-208",
      "members": [{"user_id": "user-208", "display_name": "Вера"}]
    }
  }
}
