{
  "command_id": "cmd-gd-019",
  "user_id": "user-219",
  "timestamp": "2026-02-10T10:02:00+00:00",
  "text": "Clean the кухня please",
  "capabilities": ["start_job", "propose_create_task", "propose_add_shopping_item", "clarify"],
  "context": {
    "household": {
      "household_id": "house-219",
      "members": [{"user_id": "user-219", "display_name": "Mike"}]
    }
  }
}
