{
  "command_id": "cmd-wp000-012",
  "user_id": "user-212",
  "timestamp": "2026-02-01T10:11:00+00:00",
  "text": "Добавь сахар в список покупок",
  "capabilities": ["start_job", "propose_create_task", "propose_add_shopping_item", "clarify"],
  "context": {
    "household": {
      "household_id": "house-212",
      "members": [{"user_id": "user-212", "display_name": "Миша"}],
      "shopping_lists": [{"list_id": "list-4", "name": "Продукты"}]
    },
    "defaults": {"default_list_id": "list-4"}
  }
}
