{
  "command_id": "cmd-wp000-015",
  "user_id": "user-215",
  "timestamp": "2026-02-01T10:14:00+00:00",
  "text": "Купи",
  "capabilities": ["start_job", "propose_create_task", "propose_add_shopping_item", "clarify"],
  "context": {
    "household": {
      "household_id": "house-215",
      "members": [{"user_id": "user-215", "display_name": "Марина"}],
      "shopping_lists": [{"list_id": "list-1", "name": "Продукты"}]
    },
    "defaults": {"default_list_id": "list-1"}
  }
}
