{
  "command_id": "cmd-gd-021",
  "user_id": "user-221",
  "timestamp": "2026-02-10T10:04:00+00:00",
  "text": "Купи молоко, хлеб, масло, сыр и яйца",
  "capabilities": ["start_job", "propose_create_task", "propose_add_shopping_item", "clarify"],
  "context": {
    "household": {
      "household_id": "house-221",
      "members": [{"user_id": "user-221", "display_name": "Лена"}],
      "shopping_lists": [{"list_id": "list-1", "name": "Продукты"}]
    },
    "defaults": {"default_list_id": "list-1"}
  }
}
